{
  "schema_version": "openguard-bench-manifest/2.0",
  "identity": {"manifest_id":"bmf_detector_development_v1","revision":1,"created_at":"2026-09-22T10:30:00Z","parent":null},
  "benchmark": {"benchmark_id":"bench_detector_development_v1","title":"Detector input contract development fixture","task_types":["risk_detection"],"label_set_version":"development-input-1","case_granularity":"fixture","scope":{"included":["fixed detector input contract"],"excluded":["human gold and formal metrics"]},"matching_policy_artifact_id":"art_policy"},
  "artifacts": [
    {"artifact_id":"art_source_index","role":"source_index","path":"fixtures/source-index.json","media_type":"application/json","size_bytes":353,"sha256":"7f691b28444dd9e9a549a75b9c429533d7d93af6d6d51a91432ce243f7ac96cf","redistribution":"repository_allowed"},
    {"artifact_id":"art_detector_input","role":"source_index","path":"fixtures/detector-input.json","media_type":"application/json","size_bytes":424,"sha256":"ae6c07e7614bb795761cae69cdcbd20bdcc25a31c80131e3673c6bf015d17218","redistribution":"repository_allowed"},
    {"artifact_id":"art_detector","role":"run_config","path":"fixtures/detector-artifact.json","media_type":"application/json","size_bytes":451,"sha256":"549fdf6b334a21077ebabb0249209aaab6fad8b69dd1f9cc798a39bf8775ef3c","redistribution":"repository_allowed"},
    {"artifact_id":"art_gold","role":"gold","path":"fixtures/gold.json","media_type":"application/json","size_bytes":292,"sha256":"a0dccb083ac8752adffdfe28667e9d8b391915ae1e0cb393e48f8a1e49c04157","redistribution":"repository_allowed"},
    {"artifact_id":"art_policy","role":"matching_policy","path":"fixtures/policy.json","media_type":"application/json","size_bytes":280,"sha256":"2c08fb4eec2a3f08b2b348fc6c0152059d183caf37143680cfbd8e43109652e6","redistribution":"repository_allowed"},
    {"artifact_id":"art_config","role":"run_config","path":"fixtures/config.json","media_type":"application/json","size_bytes":302,"sha256":"34510582aa7469f18f7caa4c853e61fea8beb379e74d1bd7f0823b113ead73d4","redistribution":"repository_allowed"},
    {"artifact_id":"art_prediction","role":"prediction","path":"fixtures/prediction.json","media_type":"application/json","size_bytes":344,"sha256":"d53ca6dce513b26bd529201d3761690cfb4e15aca1c0bc0f0d15b482d5aab7a0","redistribution":"repository_allowed"},
    {"artifact_id":"art_result","role":"result","path":"fixtures/result.json","media_type":"application/json","size_bytes":369,"sha256":"bd95b4b248f6dffd4fe95a04c378dcac64666925a6d6ddb5a4b72c0cda36b289","redistribution":"repository_allowed"}
  ],
  "cases": [{"case_id":"case_b03b04_v2","family_id":"family_b03b04_v2","content_sha256":"36fa84ded555530848ea47d88cfa28dec1414653f87d00664cc0ead22c42e95c","split":"dev","source_artifact_ids":["art_source_index","art_detector_input"],"gold_artifact_id":"art_gold","authorization_status":"verified","included":true}],
  "governance": {"reviews":[],"exposures":[{"split":"dev","actor":"b05_fixture_author","purpose":"rule_development","occurred_at":"2026-09-22T10:30:00Z","artifact_id":"art_detector_input"}],"disputes":[],"freeze":{"status":"frozen","frozen_at":"2026-09-22T10:31:00Z","artifact_ids":["art_gold","art_policy"],"frozen_by_actor_type":"human"}},
  "amendments": [],
  "evaluations": [{"evaluation_id":"eval_detector_development_v1","benchmark_revision":1,"target_split":"dev","system_revision":"git:a34c29f","gold_artifact_id":"art_gold","matching_policy_artifact_id":"art_policy","run_config_artifact_id":"art_config","prediction_artifact_id":"art_prediction","result_artifact_id":"art_result","started_at":"2026-09-22T10:32:00Z","finished_at":"2026-09-22T10:32:00Z","requested_tier":"development"}]
}
